VideoID,Comments
VVCEtqfqFkg,"Подскажите пожалуйста,врач удалил один нерв в первом зубе, по снимку удеально запломбировано, но вокруг нерва видно воспаление . Прошло 5 месяцев ,дискомфорт в зубе присутствует, врач говорит ,что не надо перелечивать. Нормально ли это? Сколько времени может сохраняться воспаление в зубе ,при удаленном нерве. Может много пломбы,и она давит?"
VVCEtqfqFkg,"Доктор, подскажите пожалуйста..<br>Стоматолог поставил пломбу без удаления нерва, при надкусывании больно, уже две недели. Я написала ей о проблеме, советует пропить найз неделю, что думаете об этом? У меня то он болит только когда жую ну и потом может немного. Обязательно ли пить этот Найз? Или лучше все таки удалить нерв? На холод зуб тоже очень реагирует 🥺ответьте пожалуйста."
VVCEtqfqFkg,"ХРЕНОВЫЕ МАТЕРИАЛЫ, ВОТ ЕДИНСТВЕННЫЙ ВЫВОД. РАНЬШЕ ПОДОБНОГО НЕ-БЫЛО..."
VVCEtqfqFkg,"Здравствуйте, очень информативно, но у меня другая проблема, мне вылечили пульпит, запломбировали все было хорошо, но спустя 3 месяца началась сильная боль при прикусывании"
VVCEtqfqFkg,"Спасибо, Доктор! Очень информативно!!!!!"
VVCEtqfqFkg,"А может стоит сказать правду о том, что у врача не хватило опыта и квалификации для лечения периодонтитного зуба и поэтому возникло воспаление и гной в переходной складе. А далее пациент становится &quot;неудобным клиентом&quot;, потому, что у врача не хватило опыта и смелости признать это, а перелечивать доктор очень не хочет, т.к это уже становится затратным мероприятие . Пора бы уже честно говорить о том, что врач молограмотен и не мотивирован в вылечивании зубов, а цель его развод на имплантацию."
VVCEtqfqFkg,Почему болит зуб при лечении канала? Когда стоматолог просовывает в каналы инструмент типо иглы и при нажатии болит зуб?
VVCEtqfqFkg,"Здравствуйте,лечил зуб от переондотита 3 месяца назад говорили что зуб мертвый так вот почему начел опять болет если стучишь по нему и надавить зубами что это?"
VVCEtqfqFkg,"Подскажите пожалуйста сколько может болеть зуб при перелечивания  каналов так как не до конца был запломбирован  , хронический периодонтит  , чистили и промывали очень долго  . Зуб не болит , но не приятный дискомфорт . Поставили лекарство ."
VVCEtqfqFkg,вы самый охуительный
VVCEtqfqFkg,"Здравствуйте,а зуб после кисты сложно удаляется,если он просто как молочный откололся,корень иду удалять"
VVCEtqfqFkg,"Аболмасов-фамилия арабская. 🤔 может, все же Аболфасов было изначально? Это все-же тюркская фамилия, а значит более российская. В России много кореных тюркских народов да и из соседних республик много"
VVCEtqfqFkg,Скажите пожалуйста а можно поставить серебрянопаладевые коронки с золотым напылением? Это совместимо?
VVCEtqfqFkg,"Здравствуйте, удалили жевательный верхний зуб ничего не болит на второй день увидел какой то нарост из этой лунки как будто кожа, что это такое?"
VVCEtqfqFkg,"Доктор, есть ли средство для укрепления депульпированного зуба. В смысле, которое временно наносится на зуб, например, в виде геля?"
VVCEtqfqFkg,"С 4.30: так и есть. Увы, имея в этом печальный опыт, скажу - так и есть. После работы с каналами зуба боль появляется именно на 2-й день."
VVCEtqfqFkg,я  после  50     стал  удалять   😂👍
VVCEtqfqFkg,найс    помогает   при  болях   или    брехня?
VVCEtqfqFkg,"У меня после лечения болеть начал , а до лечения не беспокоил вообще ,врач назначил антибиотик и лазер , всё сразу успокоилось"
VVCEtqfqFkg,Здрастувуйти у меня кров и гной тичёт приножати как називаетсия это болезны зуби разшоталась
VVCEtqfqFkg,"А у меня вопрос: если после чистки канало зуб не болит но реагирует на кислое, это вот что означает?( Не при накусывании, не на холодное/горячее, а на кислое"
VVCEtqfqFkg,"У меня недавно был случай. Перелечивала каналы в нижней ,,семёрке,,. 4 штуки. То есть зуб уже был депульптрован лет 15 назад, и вот понадобилось вскрыть, потому что под пломбой процесс начался. Врач каналы почистила, промыла чем то, что воняло как хлорка, и положила какое то лекарство пож временную пломбу, и отправила меня до вторника ходить с лекарством, но по моему это не мышьяк. А был вечер четверга. К субботе зуб у меня разболелся просто неистово. Как всегда же, в выходные. Бегала по городу искала кто мне снимет пломбу и промоет. Еле нашла в самой дорогой клинике. Промыли, поставили какое то другое лекарство, доходила до вторника без проблем. Мой врач сказала что так среагировал один из каналов где было основное воспаление"
VVCEtqfqFkg,"Дайте пожалуйста номер телефона,вашей клиники, очень хочется с вами проконсультироваться!"
VVCEtqfqFkg,"Как с вами связаться,товарищ доктор,вы так красиво рассказываете о зубах."
VVCEtqfqFkg,👍
VVCEtqfqFkg,"Прямо про мой случай сегодняшнее Ваше видео! Лечили 3,8 с большим кариесом (он нужен оказался, так как сверху на место 2,7  поставили имплантат, который вынужден опираться на 3,7 и 3,8. Как я поняла по КТ, имплантат поставили косо, но врач, конечно, молчит об этом, а я претензий не предъявляю, потому что уже бесполезно что-то менять). В итоге, если до 3,8 не дотрагиваться, то он молчит, но на температуру и надавливание реагирует болью, которая быстро проходит. Взяли с меня сумму за его лечение больше в 2,5 раза,  чем за лечение другой 8-ки  и врач бормотала, что скоро в этом 3,8 придется удалять нерв и ставить коронку. Прошло уже 2 месяца и понимаю, что врач знала, что зуб будет болеть, что я приду перелечивать и буду по гарантии это делать, поэтому и сумму огромную с меня за него взяли (включив будущее лечение по гарантии). Но пока я не пошла его перелечивать, просто терплю эти периодические боли, но понимаю, когда на имплантате 2,7 появится коронка, она при жевании будет давить на 3,8 и мне будет больно при жевании всегда. Идти сейчас перелечивать или ждать, когда на 2,7 коронку поставят??? Может не при каждом жевании будет больно?"
VVCEtqfqFkg,"Здравствуйте, спасибо за очередной информативный ролик на вашем канале."
W_e0tMXNVls,"Получить более подробную консультацию о стоимости услуг или сразу записаться на бесплатную консультацию, Вы можете по телефону +74951340330.<br>Также задавайте свои вопросы нам по Whatsapp +79850089484 или кликните по ссылке <a href=""https://wa.me/79850089484"">https://wa.me/79850089484</a> , чтобы сразу в Whatsapp начать чат с нашим специалистом.<br>Со стоимостью услуг Вы можете ознакомиться на нашем сайте по ссылке <a href=""https://www.7894444.ru/tseny?from=yt7"">https://www.7894444.ru/tseny?from=yt7</a><br>Наши клиники расположены в Москве, Санкт-Петербурге и в Нижнем Новгороде. Узнать адрес ближайшей к Вам клиники Вы можете на нашем сайте по ссылке <a href=""http://www.7894444.ru/adresa-klinik?from=yt6"">http://www.7894444.ru/adresa-klinik?from=yt6</a><br><br>Содержание:<br><a href=""https://www.youtube.com/watch?v=W_e0tMXNVls&amp;t=26"">0:26</a> - внешние факторы, которые повышают чувствительность зубов (раздражители)<br><a href=""https://www.youtube.com/watch?v=W_e0tMXNVls&amp;t=39"">0:39</a> - краткое устройство зуба и причина почему у здорового зуба низкая чувствительность<br><a href=""https://www.youtube.com/watch?v=W_e0tMXNVls&amp;t=58"">0:58</a> - причины появления чувствительности (разрушение эмали, оголение корней зуба)<br><a href=""https://www.youtube.com/watch?v=W_e0tMXNVls&amp;t=90"">1:30</a> - причины оголения корня зуба<br><a href=""https://www.youtube.com/watch?v=W_e0tMXNVls&amp;t=109"">1:49</a> - как остановить рост чувствительности зубов<br><a href=""https://www.youtube.com/watch?v=W_e0tMXNVls&amp;t=132"">2:12</a> - признак пародонтита"
W_e0tMXNVls,Видео не о чем только бизнес 😂
W_e0tMXNVls,Короче толком ничего не объяснил как облегчить чувствительность<br>Просто обратитесь к стоматологу. <br>Нахй ролик снял
W_e0tMXNVls,"Зуб вылечили от кариеса, поставили световую пломбу, но на горячее или холодное дико стреляет("
W_e0tMXNVls,А если все  время  передние зубы зудят?
W_e0tMXNVls,"Доктор не знал проблем с чувствительности зубов, как только пошёл на проф чистку , замучили полтора часа <br><br>И после супер чувствительность горячее холодное 70% зубов болит убиственно<br><br>Уже месяц прошло не проходит <br>Чем востоновить"
W_e0tMXNVls,Поможить мени будь-ласка.<br>У мене после холодной гарячой еде болять зуби уже более 3 месяца  що робити подскажите.
W_e0tMXNVls,На сладкое оскома🤔почему?
W_e0tMXNVls,Я не когда у зубному врачу не ходила у меня просто так появилась ша ХОЛОДНЫЕ ВОДИ И ДРУГИЕ НЕ МОГУ ПИТ
W_e0tMXNVls,Зубные пасты для чувствительных зубов помогают или это просто миф?
W_e0tMXNVls,Вас нет в ватсапе
W_e0tMXNVls,"Добрый день! Спустя где-то 1-2 недели после лечения кариеса, зуб стал слишком чувствительным … даже на водичку комнатной температуры начинает реагировать - ныть 🦷<br>С чем это может быть связано? Заранее благодарю 🙏🏼"
W_e0tMXNVls,"Здравствуйте.появилась чувствительность коренного зуба рядом с зубом мудрости(по соседству) . Зуб мудрости вырвал, подумал может из за него что давит. Прошëл месяц всë ровно повышения чувствительность. Что делать? Пройдëт ли со временем само?"
W_e0tMXNVls,У меня после ставки новых зубов стали чувствительными на холодный и на горячую что делать та?
W_e0tMXNVls,👍
1Hv2F2Yituk,У меня дико разболелось горло примерно через час после удаления 6 зубов.глотать очень больно.что делать?
1Hv2F2Yituk,"Берегите сгусток любыми способами!!!! У меня альвеолит , это ужас. От запаха не избавиться, болит ухо, болит лимфоузел, болит пол челюсти, сверху и снизу. А чистка этой лунки просто непереносимо, врач не смог через 3 заполнить лунку кровью, наложили лекарство. Промывание лунки терпимо , но тоже очень больно."
1Hv2F2Yituk,"ребята скажите пожалуйста, как долго болела горла после удаление зуба мудрости,? Не могу глотать слюну, болит и ухо , ужасно не могу открыть рот . Два зуба мудрости удалена с двух сторон права не болит с левой и место зуб болит и горле только в тот же стороны и ухо ."
1Hv2F2Yituk,"Подскажите пожалуйста ,я месяц назад удалила сложную нижнюю 8 ку и между десной как будто валик по ощущениям ,трогую внутри щеку и чувствую на ощупь этот валик, как будто там жидкость какая то есть внутри припухлости щеки  ...а с внешней стороны щеки не отека ...что это может быть ...жевать тоже не удобно мешает этот валик"
1Hv2F2Yituk,Как узнать какой зуб болит если напухает шеки от бороды ?Зубы не болят кроме когда вырвал 1день поныло и все
1Hv2F2Yituk,"А мне удалили верхнюю шестерку и ушили рану,все предписания врача исполняла,но все равно    через 4 дня почувствовала противный вкус и запах трупа во рту,никакой боли,отеков,но эти компоненты присутствовали,когда сняли швы,врач наложила какую то пасту,и запах пропал и во рту стало вкуснее,что за паста не знаю,сказала еще раз прийти на прием."
1Hv2F2Yituk,"Здравствуйте, может быть такое, что для удаления зуба 38 зачем-то пришлось надрезать а потом соответственно зашивать лунку 36?"
1Hv2F2Yituk,"удалил 2 зуба  , за раз 1 зуб мудрости  он не сложный быстро удалил 2 сек и 2 зуб  резал десну пелил зуб  5 день есть боль у обоих зубов пульсирует  чуть щека опухла  выше зуба  боли не увеличваются  иди к стамотологу?"
1Hv2F2Yituk,"Добрый вечер, после удаления зуба мудрости на одной стороне сверху и снизу -  не открывается полностью рот, на 2 пальца только, прошло 21 день. Что делать? Ничего не болит, но рот открыть шире просто не могу -  больно, будто заклинивает на этом моменте"
1Hv2F2Yituk,Здравствуйте мне недавно удалили зуб мудрости но на лунке нету сгустка несколько дней назад врач осмотрел и сказал что там грязно и нету крови если врач не опорен и так останитсья что будет и мне больно
1Hv2F2Yituk,Музыку по громче атом не понятно
1Hv2F2Yituk,Улалили 2 зуба нормально всё будет ??
1Hv2F2Yituk,"Доктор,помогите пожалуйста советом.Мне вырвали пятый зуб сверху от середины на правой стороне.,т.к зуб после установки штифта и коронки ныл пол года ,врач выбивал молотком и потом нарастил кость.Уже прошло 4 недели рана болит ,хотя снаружи зажила .Была у хирурга челюстного он сделал 3Д снимок сказал ,рана заживает внутри хорошо,а у меня болит лицо с правой стороны где вырывали зуб и челюсть,ночью я давлю от паники и стресса зубами,что вызывает боль челюсти ,головы и глаз и затылок,сплю очень мало,просыпаюсь отболей каждую ночь,пью уже 4 недели ибупрофен.Назначили челюстной   физио терапию (массаж),она немного погладила по скулам ,надала на затылке точки .Хирург сказал ждать.Как долго проходит болевой синдром если нерв весь раздражён на правой стороне лица и в скулах? Пройдёт ли этот ад? Спасибо за ответ."
1Hv2F2Yituk,"2 февраля удалили три передних зуба , две лунки быстро затянулись , а второй у клыка до сих пор воспалительный процесс ( там был осколок зуба и 16 февраля делали ревизию и было уплотнение над десной  , лунка затянулась,  но с огромным рубцом . Дренажа , перевязок и антибиотиков не назначали Была у врачей - делайте аппликации  из метрогеля . Подскажите что же делать ?"
1Hv2F2Yituk,Подскажите пожалуйста если на 5 день после удаления верхней восьмерки поднялась температура небольшая что делать но лунка не болит и отека нет ? Это может быть из за простуды или все таки из за зуба
1Hv2F2Yituk,Самле страшное это перфорация и свищ..а у вас и нет
1Hv2F2Yituk,"Здравствуйте! Скажите, пожалуйста 🙏🙏🙏4й день после сложного удаления. Распиливали зуб. Изначально был чуть треснутый. Врач применял силу при удалении. Сказал болеть не будет. Но три дня я ьыла на частом приеме обезболивающих(ибупрофен, так как кормлю реьенка), но помогали они слабо. Вчера на ночь выпилп, так как боль была нестерпимая. Лунка пульсировала, дергала. Ночь поспала, утром снова болит. Уже не дергает. Но то сильнее, то слабо. То ноет. С виду лунка в норме, сгусток на месте. Десна, конечно, опухшая. Отек на щеке совсем небольшой. Вчера весь день дклала ванночки ромашка, сода, соль. Вечером уже не выдержала и плмазала Левомеколь. В-общем, норма ли это или бежать к врачу? Повторюсь, врач не уеремонился в поликлинике. Ломал зуб как ступеньку в подьезде. Один раз пила соскочила на десну"
1Hv2F2Yituk,Спасибо
1Hv2F2Yituk,У меня удалили два корня . сегодня пятый день болит десна
1Hv2F2Yituk,"Після видалення нижнього зуба мудрості ясна зверху зрослись, а збоку ні, і там вийшов наче такий можна сказати карман, туди потрапляє їжа а я нічого не можу з цим зробити, це нормально?"
1Hv2F2Yituk,"Чи можлива онлай консультація?<br>Є одне питання, а я знаходжусь за кордоном і не можу потрапити до лікаря який знає українську("
1Hv2F2Yituk,Здравствуйте хотел узнать после анастази могут быть рот жолтым
1Hv2F2Yituk,Здравствуйте спасибо за Тех- поддержку бедалаг ) всем здоровья и удачи!
1Hv2F2Yituk,Нужно ли делать рентген перед удалением зуба мудрости?
1Hv2F2Yituk,"У меня от зуба мудрости столько проблем появилось: несколько месяцев очень сильно болело горло будто в горле струна натянута, опухли лимфоузлы - стало тяжело дышать, шла      безостановочно слизь - появился  хронический фарингит - обошёл кучу лоров , но в итоге нашëл платную клинику где мне полностью промыли миндалины от жидкого гноя и стало во много раз легче"
1Hv2F2Yituk,"Пожалуй, это самое лучшее и подробное видео без &quot;бла-бла-бла&quot;."
1Hv2F2Yituk,"Спасибо, все понятно,!"
1Hv2F2Yituk,У меня десна болит 3 недели даже обезболы не помогают
