VideoID,Comments
1Hv2F2Yituk,"Здравствуйте. Посоветуйте что делать. 5 недель назад удалила нижний пятый зуб. Удаление было не сложным, но врач вытащил зуб с большим трудом-у меня довольно длинные корни. Теперь болит соседняя четвёрка, порой просто невыносимо. На месте удалённого зуба очень болезненные при нажатии край кости и небольшая шишка там, где был корень. Могут ли они давать такую боль на соседний зуб? Временами он так отекает  что смещается к языку и вверх. Я уже весь язык об него оцарапала. Хирург проблемы не видит, от чего такая боль не понимает. Лунка уже практически затянулась, а эти кости не рассасываются. За 5 недель никакой положительной динамики. Что мне делать? Уже нет сил терпеть эту боль. Сделала ортопантомограмму- вроде бы ничего нет, всё нормально"
1Hv2F2Yituk,Спасибо большое🌹🌹🌹
1Hv2F2Yituk,"Здравствуйте сегодня поставили временную пломбу, во рту горечь и лекарство запах , врача уехал на месяц, после приезда поставит  постоянную пломбу .а мне тошнит. Как я буду терпеть месяц."
1Hv2F2Yituk,У меня температура уже 4 дня
1Hv2F2Yituk,👍
1Hv2F2Yituk,👍👍👍👍
1Hv2F2Yituk,Опухла щека
1Hv2F2Yituk,Что ж я два дня назад не увидела видео
1Hv2F2Yituk,Спасибо за информацию. Это важно знать. У меня как раз случай с парестезией. Держится уже чуть больше недели 🥹 Пока ждём. Надеюсь пройдет.
1Hv2F2Yituk,Здравствуйте <br>А если отек появился под глазом и плотность в районе гаймоповых пазух после удаления верхней 8_ ки
1Hv2F2Yituk,"Здравствуйте, прошло 5 дней после удаления, отёк почти прошел, но осталось нечто небольшое очень плотное в районе челюсти в щеке (?) , что это может быть.. Нигде нет информации. Мой друг, которому тоже удаляли, сказал, что это сгусток крови, но слишком уж большой"
1Hv2F2Yituk,🤟🥰
1Hv2F2Yituk,"Добрый день.<br>Не могу найти ответ на один вопрос, перерыл весь интернет.<br>Мне удалили зуб мудрости, вместе с зубом вышла кость, кость верхней челюсти.<br>Что мне делать?<br>Куда бежать?"
1Hv2F2Yituk,"Прошло три дня, красноватая десна при нажатии болит-что делать?"
1Hv2F2Yituk,"Удалили зуб вот смотрю,молодец--полезная информация."
1Hv2F2Yituk,"Здравствуйте!<br>У меня после удаления десны появились симптомы менингита. А врачи молчат, не хотят отвечать можно ли вылечить этот менингит . АТО Я страдаю уже 8лет , головная боль, чувствительность к шуму, а по утрам иногда говорить очень даже сложно и не приятно,не понятные звуки из носа издаются,как будто в нос поставили огромную трубу и оттуда издает эхо.<br>Пожалуйста 🙏 скажите это болезнь излечима??<br>Заранее благодарю 🙏"
1Hv2F2Yituk,"У меня после удаления мудрого зуба онемело борода, ощущение как там наркоз уже 4 день. Почему?"
1Hv2F2Yituk,"Помогите пожалуйста. Сверху слева болел почти 2 года зуб, все было в порядке на снимках, пила антибиотики раз 20.дошло до того, что стали мигрени приходить часто. Настояла я на удалении. Врачи ничего не понимали, все было чисто. Боль не прошла, рана зажила, а боль в десне только усилилась. Приходит боль вместе с тошнотой, головной болью и волнообразно. Живу в Германии, никто не обращает внимания на мои жалобы. Последние 4 месяца постоянной боли. Что это может быть, если врачи ничего не видят."
1Hv2F2Yituk,Здравствуйте доктор скажите пожалуйста почему болят глаза после вырывания верхнего зуба
1Hv2F2Yituk,Спасибо большое за информацию
1Hv2F2Yituk,Здравствуйте.  Мне удалили зуб 26 июля сказал что будет простой удаления так как зуб шатается.  И удалил. Но при удаление мне было очень очень больно анестезия не подействавала я  пыталась сказать ему что больно да я плакала он все равно не остановился.  И после удаления сказал будет болеть 2 3 дня <br>Зожела нормально.  А сейчас 15 август но все ещё больно и ещё соседний зуб болит при надавление . <br>Может сказать в чем может быть проблема?
1Hv2F2Yituk,Купи новый хороший микрофон звук слышится словно из подвала 🤣
1Hv2F2Yituk,Здравствуйте  мне пломбу делали когда больно было после этого болит уже 4день боль в челюсти голова болит
1Hv2F2Yituk,"Прошли сутки после удаления, кажется, припухли места, где зашили рану, и до сих пор красноваты и немного идёт кровь, это нормально?"
1Hv2F2Yituk,"👍👍👍🤩🤩🤩 спасибо , доктор !!!"
1Hv2F2Yituk,Музыка мешает
1Hv2F2Yituk,"Болит место удаления 6й день, помогают только уколы кеторолака. 2 в сутки. И думаю. Это же ненормально, надо идти к врачу. Боль отдаёт в ухо. Вроде как щека не опухла, но почему так болит 🥺 и сгусток берегла, не полоскала, белый налёт на ране."
1Hv2F2Yituk,"Не прочитала все сообщения и, возможно, есть ответ на мой вопрос - - вчера удалили зуб и наложили какую-то резинку, сегодня она отпала. Второй зуб. Справа. Чем грозит отпад этой резинки?"
1Hv2F2Yituk,"Спасибо. Сразу подписка. Очень доходчиво. Вчера удалил зуб. Щека воспалилась к вечеру. Но отёк не сильно большой. Сегодня прощупывал левую сторону головы, висок, чуть выше и заметил какие-то хрустки чтоли внутри как будто"
1Hv2F2Yituk,Мне удалили зуб мудрости.очень болит опухла щека .пью обесболивающие каждые час потому что боль адская что делать .зуб вырвали утром а уже ночь.что делать
1Hv2F2Yituk,"Здравствуйте. Сегодня второй день после удаления ,нет отека ,боли ,а вот температура до 39. Зуб мудрости удалили ."
1Hv2F2Yituk,"Доброго! Вчера удалил два зуба. а сгусток выше лунки - это норма? Второй день наступил, и он стал меньше. В инете 0 инфы нашел по этому поводу..."
1Hv2F2Yituk,Мягкая ямка после удаления.
1Hv2F2Yituk,"Здравствуйте 💙💛. Подскажите пожалуйста 🙏 с чем может быть связана сильная непрекращающаяся ноющая боль? 5 суток прошло. Восьмёрка была в ряду со всеми, но поражена кариесом, не болел. Удаление пару секунд. Положили гемостатическую губку, зашили рассасывающимися нитками. Смотрю лунка затягивается, края сильно светлые. Температура 37. Назначили антибиотики по телефону. Делаю ванночки из Хлоргексидин Дента. То, что болит так долго - норма? 😬"
1Hv2F2Yituk,Здравствуйте. В четрерг мне удалили 6 верхний зуб справа. 2 дня болели все десна. Сегодня понедельник у меня к вечеруподнялась температура 38.0С° и под глазом возле носа припухло немного. Завтра пойду к зубной. Чего мне ожидать?
1Hv2F2Yituk,Спасибо!
1Hv2F2Yituk,На десне выросла какбудто кость после удаления зуба . Что это?
1Hv2F2Yituk,"Добрий день. Удалил нижний правий зуб мудрости,прошло 5 дней,там збоку чтото беленькое торчит 1мм,немогу открить рот а если откриваю то тянет пол летца..Подскажите нада ли ти к стоматологу? Спасибо."
1Hv2F2Yituk,СПАСИБО ЗА ОБЗОР .👍
1Hv2F2Yituk,"Спасибо,все четко сказано"
1Hv2F2Yituk,Здарсте удалил зуд 8 верхний левый уже 5день болит ухо и горло откырвать рот больно сходил врачу сказал это нормально
1Hv2F2Yituk,"Здравствуйте уважаемый! В марте удалила зуб, но до сих пор идёт онемение лица. Пожалуйста посоветуйте, что делать? Благодарю"
1Hv2F2Yituk,"Я первый раз слышу,что зашивают,у нас никогда не зашивают,и  что же делать врачу замечание?"
1Hv2F2Yituk,Что можно понять если рассказываете  беззвучными словами?
1Hv2F2Yituk,"У меня удалили зуб шестеренка и  2ч ни ела потом  поела на одной стороне и 3ч ночи кровь и сгустки идут и идут 1,или2 минуты и выплевываю черную со сгустками"
1Hv2F2Yituk,Мне удалили зуб. Когда врач вырвал зуб то вместе с зубом вырвал немного кости из челюсти примерно размером с рис. Ответье пожалуйста это нормально?
iuHbyXfaICQ,"Записывайтесь ко мне на прием с помощью сообщений или по телефону:<br><a href=""https://wa.me/972584200606"">https://wa.me/972584200606</a>"
iuHbyXfaICQ,А если не читать ?
iuHbyXfaICQ,"목사님은 아니라는것을 알고있습니다.러시아땅 무례함이 장난으로 알고 있기때문에, 돈을 지불합니다.<br><br>=   🇷🇺🚬🍺🍷🙏♥️🌹.Title=  나의 부모님과 장남 김영동은, 전능하신 하나님이 아니다= 자유선택 거짓말 자유 🇷🇺🚬🍺🍷🙏♥️🌹= 그 이유로, 무릎꿇어 빌어라 용서를. 만족이 될때까지=번역기 사용 자유선택= Свободный выбор использования переводчика . 🇷🇺🚬🍺🍷🙏♥️🌹 &quot;.  at the same  time Title=  себя телфон  электрический  запись ноль. 🇷🇺🚬🍺🍷🙏♥️🌹.         Я не принцесса в России,политики,полисмен.🇷🇺🚬🍺🍱🤔☕️🍷🙏.  Они знают Базовый IQ = Хакерство и Запись Библии. Исход 20 , Моисей Запад море.разница и занятие,год и календарь . себе молиться метод. 5:4 римлян.Фильм «Не пастор» с 개인정보 한국어 기록 &quot; 보여주어야하는 의무법? 전도단어?)서류기록,직업,에티켓요소공개.Море меняется.🇷🇺🚬유명인들 직업 제한인원수,반복.&quot; и &quot; 이재근 이름에서 COUNTLESS 도망 못간다.= 나의 부모님과 장남 김영동은, 전능하신 하나님이 아니다= 자유선택 거짓말 자유 = 그 이유로, 무릎꿇어 빌어라 용서를. 만족이 될때까지=  사진&amp;비디오&amp; CCTV 증거물= <br>10년 기타등등 년동안 식사일상단어에서 반복.= 번역기 사용 자유선택= Свободный выбор использования переводчика   &quot;, и Соседняя проповедь =  себя телфон  электрический  запись ноль , = диалог нуля.  и поэтому , мельчашиший  ветхий завет и  защание. 🇷🇺🚬🍺🍷🙏♥️🌹. Постоянно через мое приношение и т. д. получайте ответ от Всемогущего Бога. Благодарность. 🇷🇺🚬🍺🍷🙏♥️🌹."
iuHbyXfaICQ,"НЕИЗЛЕЧИМЫЙ ПАРАДОНТОЗ ?  НЕЧЕГО  ЛЕЧИТЬ СКАЗКАМИ.    До 47 лет мучался с этой дрянью , не один врач не сказал как лечить .  Передние зубы на половину дёсны съехали .  коронки оголились холодное сладкое горячее есть пить ...вешалка .  Начал чистить зубы солью ,  За две недели забыл про оскомины , десна НАЗАД ПОЛЕЗЛИ ,  ОТБЕЛИВАНИЕ ЗУБОВ СВЕЖЕЕ ДЫХАНИЕ . ВОСТАНОВЛЕНИЕ ДЁСЕН !  ГОРЯЧЕЕ ХОЛОДНОЕ СЛАДКОЕ ПОФИГУ ЛЁД МОГУ ГРЫЗТЬ .   ОБ ЭТОМ ЧЁ МОЛЧИТЕ ? !!!!!!!!!!!! <br>СОЛЬ УБИВАЕТ МИКРОБЫ ПОРОДАНТИТА . И ВЫЧИЩАЮТ ИХ ИЗО РТА . <br>ОБЫЧНАЯ МЯГКАЯ ЗУБНАЯ ЩЁТКА , И ЧУТКА СОЛИ ЛЮБОЙ . Зубные пасты все пустышки не работают к слову ВООБЩЕ !  ВОТ УЖ РЕАЛЬНО НАКИПЕЛО . Сколько народу мается от решения простой проблемы .  Наживаются на дорогом лечении , а решение под носом . <br>Можно даже представить что все компании после этого по зубным пастам накроются медным тазом . <br>сколько стоит дорогая зубная паста пустышка и сколько стоит простая пищевая соль ! Смекайте  ."
iuHbyXfaICQ,"Я через это прошел.Надо пройти чистку и пропить антибиотки.Курс лечения 1мес.Стоматологи вам это не скажут,ибо не потерять клиента"
iuHbyXfaICQ,Да используйте соль и точка это вам нескажу это стомотологии невыгодно
iuHbyXfaICQ,В Израиль не поедешь.
iuHbyXfaICQ,Что делать сначала десны с клиновидным дефектом или на них можно металкерамические коронки?
iuHbyXfaICQ,Доктор а вы из какого города. Куда приехать.
iuHbyXfaICQ,"Здравствуйте. На превью видео видно что корни как будто другого цвета, это так в норме бывает?"
iuHbyXfaICQ,"Мне делали уколы в десну воспаленную при парадонтите Линкомицина и чистку проводили, помогло на несколько лет. Еще мне помогает настойка прополиса вместе с настойкой корня аира"
iuHbyXfaICQ,Нагнал жути!!!
iuHbyXfaICQ,"Вы хирург имплантолог? <br>Мне с плохими деснами врач парадонтолог  рекомендовал процедуру Вектор, когда берут кровь из вены , на аппарате минут 7 прогоняют на центрифуге и потом делают инъекции в десны. Результат отличный.- останавливает опускание десны и они не восполяются ."
iuHbyXfaICQ,"Ничего не помогает от опущения десны, за 36 лет чем только не лечили. Могла бы на эти деньги уже две квартиры купить в Москве и машину, и дачу. Стоматологи тупо деньги выкачивают, нет у них цели реально лечить."
iuHbyXfaICQ,А что делать в домашних условиях.? Не было разговора об этом.
iuHbyXfaICQ,"Такой крутой, а без бумажки сказать не смог"
iuHbyXfaICQ,лучше расскажите как выращивать зубы самому 😂
iuHbyXfaICQ,"Деньги, деньги, деньги..."
iuHbyXfaICQ,"Здравствуйте! Такая ситуация: зуб с рецессией (в моем городе ее не &quot;корректируют&quot;) можно удалить и поставить имплант (протез- не знаю как правильно называется). Зуб этот не мешает, не чувствителен, но шатается. Жевать толком не получиться. Вот и хочу спросить у Вас не спровоцирует удаление такого зуба дальнейшее развитие на других зубах? И, если ставить имплант, все равно придется наращивать десну, ведь лунка как-то должна заживать (я не знаю всех нюансов, в челюстно-лицевой анатомии никак не ориентируюсь😂)?"
iuHbyXfaICQ,"Доктор, поможет ли плазма при опущении десны?"
iuHbyXfaICQ,"Так всё же чем лечить десна? Если воспаляются. Кушать только мягкую пищу, чтобы не царапать?"
iuHbyXfaICQ,В нашей стране здоровые зубы - это роскошь!!! К сожалению....
iuHbyXfaICQ,"Скоро уже искусственные сердца будут делать,уши печатают на принтере,а зубные протезы, которые  делали при первой мировой,делают до сих пор.Я имею ввиду съемные.Ещё у доктора Боткина были такие,которые нашим пенсионерам до сих пор ставят.Столько времени прошло,а народ до сих пор без зубов.Современное бесплатное протезирование  зубов должно стать государственной программой.Хотя бы пенсионерам и детям."
iuHbyXfaICQ,"У меня десна опускались из за наличия зубных камней.  У меня пародонтоз начался лет в 25, В 30 лет поставили на учет у пародонтолога, два раз в год меня вызывали драли зубные камни лечили и давали советы, в 40 лет сняли с учета объяснив, что таков порядок. Я с пародонтозом справмлся , но к большому сожалению узнал о способе сохранения родных зубов до 100 лет нашими долгожителями  очень поздно, когда оставалось 7 пломбированных, сильно шатающихся и кровоточащих десен. Посмотрите мой опыт                                                                                                                       Как сохранить зубы. Как избавиться от кровотечения десен и зубных камней. Опыт Куликова. <a href=""https://www.youtube.com/watch?v=7UTBkbJbS7g"">https://www.youtube.com/watch?v=7UTBkbJbS7g</a><br>Как сохранить зубы здоровыми до старости, 5 способов долгожителей. Опыт Куликова.<br>                   <a href=""https://www.youtube.com/watch?v=ksyG-2-dQuM"">https://www.youtube.com/watch?v=ksyG-2-dQuM</a>"
iuHbyXfaICQ,Хочу лечиться у вас.<br>Пришлите денег на самолёт и проживание  в Израиле. 😅
iuHbyXfaICQ,"Там где вы показываете кариес Корней Зубов это свеже посаженый мост, или я ошибаюсь? )"
iuHbyXfaICQ,А что делать десна упала когда дышу болит 🥹
iuHbyXfaICQ,Здравствуйте доктор мне 40 лет не разу в жизни не в школе ни в университете  буквално за пол года поднялась десна на одно зубе и я так понимаю что на всех начинается не могли бы вы пожалуйста помочь консультацей прошу вас очень
iuHbyXfaICQ,"Здраствуйте! У меня сдетства плохие зубы, и десна слабые! Но вы правы насчет зубной щетки, и у нас с мамой свой врач стоматолог сказал вам нужна мягкая шетка! А бесплатние это не скажут никогда! У нас хороший врач мужчина стоматолог! Пермь"
iuHbyXfaICQ,У нас санитарка в 73 года первый раз пошла к зубному -все 32 на месте.И зубные камни ни разу не снимала.А я кажжые 3 месяца камни снимаю с нижних зубов-чисти не чисти
iuHbyXfaICQ,Мне 13 лет у меня такие же зубы десна облазить что делать надо подскажете
iuHbyXfaICQ,продал квартиру - сделал зубы👍
iuHbyXfaICQ,"Чтобы в Израиль поехать лечить зубки нужно иметь в кармане 2-2,5 мл."
iuHbyXfaICQ,"Всё хорошо ,но цены не для всех"
iuHbyXfaICQ,Хорошо миленький где таких денег взять так дорого хоть бы выжить. Да нужно лечить талоны не реально взять талоны в Мурманске палец сломаешь пока дозвониться. Почему до полиции можно дозвониться а полечить сложно. Вы молодцы и фартовы наверное в той жизни заслужили. Реклама для богатых очень мило .
iuHbyXfaICQ,А золотая цепь на шее виднеется. Сколько долларами загребаешь?
iuHbyXfaICQ,"Чистая реклама, а что делать в самом начале заболевания так и не сказал... 😂"
