VideoID,Comments
NnnrwKI2M58,"О Таня! Внутрь кожи нужно проталкивать стерильные составы, типа для инъекций. Все остальное содержит консерванты, эмульгаторы и прочее, не предназначенное для подкожного введения. Нужно что-то ампульное, из аптеки например. Что имеет чистый состав."
NnnrwKI2M58,Какое приложение для перевода?
NnnrwKI2M58,Короче я купил за  10 рублей эту штуку чисто по приколу хочу попробовать будет ли давить ифект
NnnrwKI2M58,А что это за приложение такое с переводом?
NnnrwKI2M58,"<a href=""https://www.youtube.com/watch?v=NnnrwKI2M58&amp;t=499"">8:19</a> у моей мамы такой же))👀✌️"
NnnrwKI2M58,"Я которая хочу попробовать полоски для отбеливания, но у меня брекеты🥺"
NnnrwKI2M58,"Про полоски Rigel. Если честно, я никому не советую их брать, во первых они дорогие, во вторых непонятно, что из этого вылезет. Наткнулась на них у Тани, читала отзывы, а зубки то хочется белыми сделать. Ну купила и что?<br>При первом же применении эти полоски растворили мне эмаль (слегка), и все, один зуб пульсировал постоянно из за повышенной чувствительности. 4000 рублей коту в попку. Что мне с этими полосками теперь делать? Лежат пылятся, я очень расстроена"
NnnrwKI2M58,Я просто обожаю делать уроки и залипать над твоїми видео😘😍🥰
NnnrwKI2M58,😴😴😴😪😪😪😴😴😪😪😪😴😴😴😴😴😪😪😪💤💤💤😪
NnnrwKI2M58,ввилоыендмяуаяч
NnnrwKI2M58,уля
NnnrwKI2M58,укпанпип
NnnrwKI2M58,"Если хотите белых зубов,мойте их перекисью водорода каждое утро,вместо зубной пасты...проверено на меня...и дешевле,и полезнее,оно еще и дезинфицируют полость рта."
NnnrwKI2M58,"Танюша, что за переводчик, какое-то определённое приложение?"
NnnrwKI2M58,"Ссылка на щетку- это не щетка , а чехол для неё , будьте внимательнее"
NnnrwKI2M58,Если применять эти полоски зубы не становятся чувствительными ?????
NnnrwKI2M58,"По ссылке, которую вы оставили на фен-щетку, открывается чехол для нее, а не она сама"
NnnrwKI2M58,у тебя дома уже есть своя алиекспрес 😂😅
NnnrwKI2M58,Результат есть от отбеливания но не сильный
NnnrwKI2M58,ставь песню из самого самого начала на все видео! одно удовольствие слушать)
NnnrwKI2M58,"У меня есть такая штука для отбеливания зубов, но другой фирмы, там нужно после процедуры зубы почистить"
NnnrwKI2M58,У тебя очень интересно заходи в гости 😉
NnnrwKI2M58,Просто вбиваешь в поисковике <b>Ночной Блогер</b> и смотришь годный контент
NnnrwKI2M58,"Очень классное видео. Кстати, у меня есть Телеграмм канал, где я публикую самые дешевые и качественные товары с Алиэкспресс.<br>Заходите -- @alie_shop_everyday"
NnnrwKI2M58,Привет. Можно узнать ты с Украины?
NnnrwKI2M58,"Чистить зубы нужно ,девочки"
NnnrwKI2M58,"Какую маски она использовала скажите пожалуйста <a href=""https://www.youtube.com/watch?v=NnnrwKI2M58&amp;t=540"">9:00</a>"
NnnrwKI2M58,ПРИВЕТ ТАНЯ. МЕНЯ ЗОВУТ ДИНА. РЕГУЛЯРНО ПРОСМАТРИВАЮ ТВОИ ВИДЕО. Я ЗАМЕЧАЮ У ТЕБЯ НА ЗАДНЕМ ФОНЕ ЦВЕТОЧКИ КОМНАТНЫЕ. Я ФАНАТКА ЦВЕТОВ. РАССКАЖИ ПОЖАЛУЙСТА О СВОИХ ЦВЕТОЧКАХ. ОЧЕНЬ ЛЮБОПЫТНО МНЕ. СПАСИБО.
NnnrwKI2M58,По нашему 1000 рублей это 11 000 тенге многовато но не так сильно
NnnrwKI2M58,Вообше то есть результат
NnnrwKI2M58,"Таня, протестируй аппарат для приготовления мороженного"
NnnrwKI2M58,Лицо уже не помещается в кадр
NnnrwKI2M58,Какая красотка ❤️<br>👉👈
NnnrwKI2M58,Есть
NnnrwKI2M58,👋 привет ребятки зацените  цветочек который я сделала из бумаги на своем канале 😉
NnnrwKI2M58,"Крутое видео 💕<br>Но Тань, почему так актив упал? ("
NnnrwKI2M58,"пользуюсь фен- расческой уже 20 лет, но у неё зубчики только с одно стороны( как у простой массажки) очень довольна, волосы хорошо приподнимаются и можно делать красивые локоны сразу при сушке. Еще заметила один классный эффект - когда смазываешь волосы средствами для лучшего расчесывания то на горячем режиме укладки они лучше впитываются в структуру волоса и получается эффект ламинирования."
NnnrwKI2M58,Что это за переводчик такой?!
NnnrwKI2M58,А я вижу результат от отбеливания ...
NnnrwKI2M58,👏👏👏👏👍👍👍👍🥰🥰🥰❤️❤️❤️
NnnrwKI2M58,"Зуб даю, с лампой для зубов уже было видео у тебя)"
NnnrwKI2M58,ТАААНЯЯЯЯ где пальму взяла
NnnrwKI2M58,Таня можешь снять распаковки для котов
NnnrwKI2M58,Смотрю видео что бы отвлечься от смерти отца
NnnrwKI2M58,"Да, щетку я заказывала на джуме, чуть больше 1000 рублей. Незеаю насколько можно сделать укладку, но щелку укладываю ее помощью.а также несмываемые маски распределяю с помощи ее. Эфект мне нравится, и таким феном я довольна."
NnnrwKI2M58,☕✨💥
NnnrwKI2M58,"От корней, параллельно голове надо держать.. Все сделала не правильно, укладка не удалась."
NnnrwKI2M58,"Ребят,  поддержите пжл канал!<br>Только начинаю набирать свою аудиторию 😘"
NnnrwKI2M58,Красотка и стиляга танюша😘
NnnrwKI2M58,Ого! А что так можно было? Я про переводчик! Вот я отстала от жизни)))
NnnrwKI2M58,"Таня, ты оставила ссылку на чехол от расчёски, а не на нее саму!!!"
NnnrwKI2M58,"Мне обидно что ты пользуешься другим зеркалом, а не тем"
NnnrwKI2M58,"По моему, есть небольшой результат 🤔"
NnnrwKI2M58,"Таня,спасибо 💐"
NnnrwKI2M58,А что за программа с переводчиком???
NnnrwKI2M58,Привет у меня есть ютуб канал Angelina. Folzy буду рада вашей подписки ❤✌
NnnrwKI2M58,Я одна под её видосы засыпаю ночью???😂😴😴😴
NnnrwKI2M58,"Я уже сто лет пользуюсь только фен-щеткой.у меня каре,и укладка ей на раз два.главное выбрать диаметр правильно.и щётка у меня крутящаяся вообще кайф"
NnnrwKI2M58,А если у меня не рубли? Как поменять на другие деньги? Отвить пожалуйста
NnnrwKI2M58,"Результат слабенький, но кст есть. Мне кажется эта штука для постоянного использования"
NnnrwKI2M58,Что с зубами 😶😶😶
NnnrwKI2M58,"Тань, а можно заказать полосочки для отбеливания если у меня стоят брекеты??"
NnnrwKI2M58,"Ты  лучшая! Ночами смотрю твои видео все подряд.  Уже процентов 35 всего плейлиста просмотрела ). Узнала много чего нового! Успехов тебе, Танюш.  Ты умничка!"
NnnrwKI2M58,"Ребят, столько роликов про лайфхаки от торчащих волосков, а в этом видео как то с прической дело плохо.......😕"
NnnrwKI2M58,Спасибо Танюша люблю тебя пока лучше блогера не нашла
NnnrwKI2M58,<b>Приветик солнце 🌞Ждy тебя на своём канале(там вышло видео обзор палетки с Веаuty Вay 42 bright matte)💕Я стараюсь над каждым видео и рада каждому новому подписчику🥰Приму любые советы или критику❤</b>
NnnrwKI2M58,Вау вау щётка бомба💣<br>Теперь её хочу😊😊😊
NnnrwKI2M58,"Татьяна, здравствуйте! Как назыаается цветок на заднем фоне?"
NnnrwKI2M58,"Привет. Видео у тебя получилось отлично. Хотела спросить, а какой переводчик ты используешь, если не секрет?"
NnnrwKI2M58,Сразу лайк 🙋‍♀️
NnnrwKI2M58,А что за переводчик такой интересный?
NnnrwKI2M58,"Никого не хочу обидеть, но судя по зубам эти полоски не работают 😬😬"
NnnrwKI2M58,"Иду кушать, что б пришла и тут было 4 лайка❤"
NnnrwKI2M58,Видос огонь❤️
NnnrwKI2M58,Привет наша смелая мадам😇
NnnrwKI2M58,"Ты первый блогер, на которого я подписалась в ютубе)"
NnnrwKI2M58,Передние зубы очистились на мой взгляд🙂
NnnrwKI2M58,"Видя ваши ролики настроение подымается. Спасибо, очень интересно😊"
NnnrwKI2M58,"Зделай пж видосик про проверки лайхаков ,кто тоже хочет😊👇"
o2XWv5cZkAU,"Здравствуйте! А мне вот интересно.., можно ли застраховаться перед имплантацией зубов?"
o2XWv5cZkAU,Раздражает &quot; иплантант&quot;.Почему не имплант ?
o2XWv5cZkAU,Думаю   что  имплантация    это   чудо     афера    века   придумал    шарлатан      высшего    ума     эта    железяка     вкручивается    в    жиаую    костяшку     ну   кончно      это   будет    отторгаться     организмом    через    лет   5   такие   деньжищи       выкладывать   за   мусения      хрен   в   стакан
o2XWv5cZkAU,"Цены адекватные должны быть. Ещё не понятно. Откуда взялись стоматологи. С 10,15,20ти летним стажем. В сфере имплантации. Развелось имплантологов в стоматологии как блох.<br>Скорее всего потому что нащупали Клондайк. По отсосу денег у пациентов."
o2XWv5cZkAU,"Здравствуйте подскажите пожалуйста,а если произошло отторжения дважды ? Это ошибка врача ? Дважды устанавливал на одно и тоже место после заживления"
o2XWv5cZkAU,"Перфорация дна зуба тоже 1- 4 % по вине врача и я , к сожалению, попала в этот процент. Гарантии никто не может дать. У моего зятя не приживаются импланты, он тоже попал в 1%. Как угадать? Я почти потеряла зуб и боюсь продолжать"
o2XWv5cZkAU,мне 87 дет  вставили импланты  вверху и внизу челюсти - прикусывается   язык   у корня  ойкаю.. прошл 2 недели ... терпения нет  ... сегдня иду к врчу..
o2XWv5cZkAU,"Вчера был у стоматолога, он мне сказал, что не рекомендует ставить импланты, особенно вместо передних зубов, такой имплант продержиться всего два-три года, потом начнется отторжение. А вместо коренных через10-15 лет начнется отторжение, любого имплантанта. Пожизненных имплантов несуществует."
o2XWv5cZkAU,Из какого материала исскуственая кость?
o2XWv5cZkAU,"К врачам нет доверия, обезопасили себя, сняли всю ответственность"
o2XWv5cZkAU,"Мне врач сказал что никакой гарантии не дает,  потому что он не знает как организм отреагирует. Это нормально когда тау говорят? Он как бы сразу снимает с себя ответственность"
o2XWv5cZkAU,"Трещина имплантанта... Что это такое, от чего появляется?"
o2XWv5cZkAU,Короче надо проходит без своих зубов к  врачу от этого легче работается     ему .Все поставили с ног на голову это целая всемирная мафиозная структура .С начало в детстве нам зубы сверлят затем рвут т.к. уже негде сверлить а к старости предлагают поставить импланты со стоимостью чуть меньше стоимости твоей квартиры .Как же вы все достали своей наглостью
o2XWv5cZkAU,Если кровь в мизерных количествах идёт двое суток? Тут какие причины возможны? Или всё индивидуально и это норма?
o2XWv5cZkAU,"Я мучаюсь с коронкой, свой корень живой, сверху поставили коронку на нижний жевательный зуб. Постояно воспаляется десна. Чищу зубы постоянно после еды, мажу десну холисалом, и что и ничего, постоянно из под коронки запах. Может вырвать зуб и поставить имплант , чтобы не было боли в десне запаха? Кто что может посоветовать. Теперь боюсь ставить коронки, мучаюсь и мучаюсь с этой коронкой"
o2XWv5cZkAU,нихрена-се 1-2 процента??? это мало7???? а он не хочет на работе 1-2 процента заразится вич от пациента во всремя работы? точно продолжит работать???
o2XWv5cZkAU,Люди!!! Сопланетники!! Кто ставил на верхней челюсти ? На нижней 3 года ставила все прекрасно !! На верхнюю не будет ли проблем? И можно ли что то поставить временно ? Я никак не могу пол года без зубов
o2XWv5cZkAU,"У меня под коронкой образовалась щель, в которую забивается пища. Снаружи эта щель не очень визуально заметна, но она есть! И пища, забиваясь в неё, начинает плохо пахнуть. Имплантат прижился, ставился около 13 лет назад, при первой жалобе мне пытались поглубже посадить коронку- не помогло. Чего теперь с этим делать, непонятно. Хирург разводит руками, изъять имплантат нельзя, он оброс уже тканями. И чего теперь делать?"
o2XWv5cZkAU,как это нет в кости нервов?  Есть в челюсти нервы и при имплантации можно попасть в нерв  - это одно из осложнений
o2XWv5cZkAU,"Спасибо за видео. Хочу дать вам совет.Не исключаю,что вы в курсе) Если происходит онемение языка, либо жжение, то прекрасно помогает курс процедур по транскраниальной электростимуляции головного мозга. Токами низкой частоты происходит воздействие на определенные зоны мозга. Поинтересуйтесь, вдруг вам в работе пригодится!<br>С уважением, Елена."
o2XWv5cZkAU,А это не инородное тело?
o2XWv5cZkAU,"Верхняя  челюсть после имплантации вообще не болела, был дискомфорт ,но все прошло,а вот с нижней проблемы,в течении недели были дикие боли,врач советовал пить обезболы и антибиотик с противоспалительными,на снимке кт все в норме,а на второй недели гнойные выделения ,итог три имплантанта из 6 начали качаться и были удалены ,теперь жду время для повторной имплантации."
o2XWv5cZkAU,"Я бы ему поверил, если бы он небыл исколот как папуас."
o2XWv5cZkAU,"У меня второй имплант не прижился- стал качаться, и очень легко его извлекли.<br>Первый раз - неправильная установка. Второй раз врач другой уже очень серьёзно всё дезинфицировал, но всёравно началось воспаление. И даже не знаю, стоит ли пытаться 3-й раз. Очень боюсь каждый раз"
o2XWv5cZkAU,"Короче не слушайте. Легкое онемение, не больно. Я 10 дней умирала от боли головной, ничего не помогало. Онемение лютое. Если б меня предупредили о последствиях - в жизни бы не поставила имплант. Доктор Мартиашвили Анри, Спб ✊🏻 не советую"
o2XWv5cZkAU,Что значит нет нервных окончаний??? У меня уже 2 недели после имплантации- онемение не ушло до сих пор. Уйдет ли? Никто не дает гарантий
o2XWv5cZkAU,"слушаю и просто недоумеваю, это вы серьезно? Если вдруг какие-то проблемы- мчитесь к врачу????!!! А не врач должен примчаться к пациенту, который оплатил огромные деньги за имплантацию? И почему до сих пор нет госпитализации после таких оперативных вмешательств, в таком состоянии далеко нелегком после всех этих процедур, человек должен уехать и может в др. город и еще как-то доехать до дома!!!!! Нет слов, нет слов, сервис на высшем уровне за бешеные деньги!!!!!!!!!!!!!"
o2XWv5cZkAU,"А ещё имплант вылетел, боль была адская. Меня выставили с кабинета, сказали, что его пациенты ждут, а я отвлекаю. Даже остатки швов не сняли. Во так вот в городе усть-илимске и делают. Не знаю идти ли теперь заново."
o2XWv5cZkAU,"Мне в 2 раза устанавливали. Оба раза опухоль и вылетел. Сказали, что у меня бактерии во рту. Вот так. Сказали через 2 месяца опять будут устанавливать. А следом сама коронка от импланта отвалилась.весь рот у меня был санирован, все пролечено и почищено. Как быть? Я могу сказать, что у меня не прижимается. 3 прижились. А 1 никак"
o2XWv5cZkAU,ИмплантАНТ ! )))) Это что? )  Что за зверь такой?  На великом узком языке? )))) <br>ИМПЛАНТ  - для всего мира
o2XWv5cZkAU,Не у каждого есть 2 млн рублей чтобы заполнить свой рот зубами 🦷🦷🦷🦷🦷🦷🦷👀
o2XWv5cZkAU,"В Японии уже придумали какое то средство, которая помогает заново вырасти зуб 🦷. Пока на свиньях и мышах по моему опыт удачно провели."
o2XWv5cZkAU,Спасибо
o2XWv5cZkAU,"Лучше не делать отваляться через какое-то время, если есть паоадантоз,парадантит, деньги только на ветер-это мне доктор медецынских наук сказал,челюстно-лицевой хирургии!"
o2XWv5cZkAU,"Ужас порезали десну, занесли инфекцию, сутки мучилась, думала голову отрубить больно пздц, через время имплант не прижился опять резали десну удаляли имплант, это было филм ужас, деньги вернули, лежу сечас отхожу и теперь боюсь зубников, думаю лучше старый добрый протез!"
o2XWv5cZkAU,Спасибо за информацию я просмотрела очень много интервью
o2XWv5cZkAU,Ну какой ты Конников?
o2XWv5cZkAU,"Я из Узбекистана и недавно мне поставили импланты 3 на нижней челюсти, три на верхней.Скажите пожалуйста а такое количество имплантов, поставленные одновременно не вредно для организма.И ещё вопрос, что должен назначить врач после установки имплантов?"
o2XWv5cZkAU,Им вообще похе... Лишь бы бабки им принесли!
o2XWv5cZkAU,"Не стоит забывать, что это тоже протезы. А жа протезами нужно ухаживать.<br>Ирригатор обязательно и раз в 3 месяца парандологическая чистка у врача. И тогда есть надежда, что твои импланты будут стоять долго."
o2XWv5cZkAU,"Не врите пожалуйста.Суть в том,что человек должен избегать инфекций до конца своих дней.Если не дай бог в десне появится какая то инфекция...то может вызвать воспаление около импланта,что за собой повлечет большие проблемы."
