VideoID,Comments
NjBSy2Da4KE,"Здравствуйте месяца 3- 4 назад лечили зубы мудрости, врач сказала не все лечат их но я сделаю.прошло пару месяцев  После жевания  жвачки заболел верхний. А после надкуса помидор нижний. Что делать, может зря лечили"
NjBSy2Da4KE,"Спасибо, болели от холодного 4 пломбы буду ждать 2 недели надеюсь пройдет"
NjBSy2Da4KE,"Здравствуйте, один передний зуб, удалили нерв , поставили временную пломбу, но оно все равно болит и чувствую эту боль ужасно, но врач пот тачил и поставил мне зуб но все зубы я не чувствую боли а именно одного зуба боль я чувствую, что это может быть?"
NjBSy2Da4KE,Я сегодня в больницу пошла  и коставила рлобу это больно
NjBSy2Da4KE,Мне теперь терпеть 5зубов терпеть 2-3недели 😢
NjBSy2Da4KE,а если пломба чуть завышенная но при еде не чуствую а когда рот закрыт ее не чуствую но при этом этот зуб будто ломается
NjBSy2Da4KE,"Здравствуйте, спасибо большое за видео! Убрали старые пломбы, поставили одну - световую. Просверлили глубоко ткани, открылась маленькая дырочка к нервным каналам. Прошло уже более 2х недель, зубик чувствует холодное и горячее и есть боль при надкусывании пищи, но он не ноет и сам по себе не болит, только при манипуляциях! Может ли помочь лазерное лечение и пасты и сохранить нерв живым? Благодарю♥"
NjBSy2Da4KE,"Добрый день. Наткнулся на ваш канал, понравилась преподнесение информации. Подскажите пожалуйста. Лечил кариес сразу у двух рядом стоящих зубов, у одного меняли старую пломбу, у дрогого был кариес. Так вот после лечения, зуб стал остро реагировать при нажатии на пломбу в определенных местах. Поясню, если жевать что то мягкое все хорошо, зуб не беспокоит, не ноет ни днем ни по ночам, нахолодное горячее не реагирует. И именно при надавливании на пломбу чем то твердым, ну например косточка винограда, или косточка в меся, происходит сильная боль, как на синяк надавить. Причем так на обоих зубах. При повторном обращении подточили пломбы, хотя они мне не мешали. Врач сказала, что если не проидет то удалять нервы только.. В итоге через пару месяцев поехал удалять нервы, но после того как она убрала пломбу, она сказала , что ей жалко зуб, что до нерва еще далеко, и предложила поменять пломбу, на что я естественно согласился. Ситуация немного поменялась, но не ушла, зуб так же реагирует, но уже чуть в другом месте, именно когда давление на саму пломбу, по середине, прям в канавке,даже если еле задевать зубочисткой пломбу в этом месте, чувствуется как буд то я по нерву скребу:) Не знаю как лучше передать это..... Если давить по бокам зуба как бы на вершине, не больно, но только еда попадает в середину зуба и спресовывается в канавке, начинается чувствительность. Решил ждать, мб проидет, не хочу пока удалять нерв/ Сколько такое может болеть?))) По снимкам паталогии нет."
NjBSy2Da4KE,Здравствуйте мне вот поставили пломбу и она не болела потом через несколько дней начала сильно болеть надавливаю болеет и я его не трогаю но все  равно болеет пробовал способы боль проходит и обратно болеет что сэтим делать скажите пожалуйста
NjBSy2Da4KE,скажите какие симптомы пульпита в 6 и 7 зубах?
NjBSy2Da4KE,У меня прошло в течение 3-4 мес только
NjBSy2Da4KE,"Здравствуйте, при осмотре у стоматолога, врач посоветовала запломбировать клиновидный дефект зуба. Было запломбировано четыре зуба, после чего два зуба стали особенно чувствительны, жевать на сторону этих зубов не могу. Уже почти две недели прошло, а улучшений никаких, причем до пломбирования зуб вообще не беспокоил. Стоило ли вообще пломбировать этот клиновидный дефект и что теперь делать?"
NjBSy2Da4KE,"Здравствуйте, поставил пломбу чуть больше месяца назад,нерв не удаляли,все было нормально ,только слегка повышенная чуствительность на холодное и горячее, теперь же начал болеть,ноющая боль с утра,только обезбаливающие помогают,отека никакого нет,я беспокоюсь что может быть воспаление,хотя уже прошло около 45 дней, из за чего в моем случае может болеть?Заранее спасибо за ответ"
NjBSy2Da4KE,"У меня несколько недель , ничего не болит просто так, но на холодное и жестковатое есть неприятные ошущения, иногда их нет, но чаще есть. Несильная терпимая боль, но все равно очень неприятно. Может врачь хотела, чтоб я похудел)) При жалобах говорит что пройдет. Но когда это случится?"
NjBSy2Da4KE,У меня конкретно болит. Не знаю что делать
NjBSy2Da4KE,"Здравствуйте. Мне три для назад  почистили глубокий кариес и заменили пломбу. Боль не утихает, ночью усиливается . При всем этом , без причины болит не только тот зуб, который лечили , но и противоположные здоровые зубы.  Такое явление нормально ?"
NjBSy2Da4KE,"Здравствуйте, подскажите пожалуйста, после установки пломбы зуб хорошо себя чувствовал две недели, могла и есть и пить всё и ничего не беспокоило, но спустя 2 недели после установки пломбы я пила кофе и зуб начал стрелять и пульсировать, после этого в этот же день я ела круассан и тоже зуб начал сильно реагировать и стрелять, что это может быть? Причем первую такую реакцию зуб дал неожиданно и на именно на кофе который был нормальной температуры. Пока не жую на той стороне где пломба. Подскажите пожалуйста почему такое может быть и что делать? Подождать какое то время или записаться на прием?"
NjBSy2Da4KE,У меня уже несколько месяцев болят 😢😢
NjBSy2Da4KE,"здравствуйте,ответьте пожалуйста,вчера была у стоматолога,поставили пломбу,до этого удалили нерв. Всю ночь не спала от болей,при давление на зуб он начинает ужасно болеть,реакции на холодное и горячее нету. Это нормально?"
NjBSy2Da4KE,"Здравствуйте! Я пошла к стоматологу 5 дней назад , мне ставили пломбу. Когда мне ставили на ватку обезболивающее, перед уколом обезболивающим.  Мне доктор сказала что если эту ватку долго держать может быть ожог десны.  Я очень боялась и передержала ватку.У меня опухла десна , мама позвонила доктору , и она сказала что там гной, и может стать ещё хуже .   <br>Мама не много надовила на десну , и увидела гной . Поставила ватку с раствором соли. Стоматолог сейчас в отпуске на неделю.  Скажите пожалуйста что делать, и какие последствия ?"
NjBSy2Da4KE,"У меня вот такая проблема, после пломбы у зуба появилась стреляющая боль, очень часто, когда к примеру начинаю глотать слюну и тем самым появляется не большое давление на зуб, то и происходит кратковременная стреляющая боль, уже как 2 недели прошло это продолжается. Есть какая то информация? Стоит ли идти опять к стоматологу?Очень не хотелось бы конечно."
NjBSy2Da4KE,"Смотрите,поставил пломбу еще несколько месяцев назад. Зуб когда кушаю что-то вообще не болит,но реагирует на хоолодное и иногда гарячее. Не мог понять в чем проблема,а сменив зубную пасту он практически не чуствует холодное и горячее. Иногда зубы бывают чуствительны в какой-то день. А следующий все отлично. Это может зависить от зубной пасты?? Зубысами по себе не болят,когда имено кушаешь все ок,но реагировал на холодное и горячее."
NjBSy2Da4KE,"Уже прошло чуть более месяца, чувствительность все еще не прошла."
NjBSy2Da4KE,"Здравствуйте мне поставили большую пломбу после вторичного кариеса, уже прошло 40 дней неприятные ощущения остаются: ощущения страные,  начинает ныть сам по себе без какого либо провацирания , раньше ныл каждый день и раз в два дня, то теперь раз в три дня , и ноет так что я могу не замечать особенно когда занят или слушаю музыку, ошущения терпимо, но просто иногда колит как будто иглой , вопрос может это перасти сразу в острую вплоть до потери сознания или мне не стоит беспокоится? , может это быть связано с разаитием третичного дентина? Визуально пломба в нижней части зуба занимает 25 % и поднимается пиком вплоть до десны , возможно ли что резко появится сильная боль и будет постояна, у меня никогда не было сильной боли и я не знаю что ожидать."
NjBSy2Da4KE,"Здравствуйте ответьте пожалуйста <br>Мне очистили кариес и поставили мышьяк, после 2 дня убрали мышьяк но нерв не смогли убрать так как канал был закрыт, потом поставили пломбу, что делать?"
NjBSy2Da4KE,"Доктор,скажите пожалуйста. Зуб не болел,проводили санацию,залезли в зуб,пролечили ,поставили пломбу.Зуб реагирует на холодное и горячее,доктор записал повторно только через три недели(частная клиника). Я терплю это время.Важный вопрос:должна ли я во второй раз оплачивать лечение зуба,удаление нерва и так далее. Если должна,то где тогда мои права,зуб вообще не боле,врач сказал,была внутри большая дырка.Если была,мог ли доктор изначально как нужно пролечить?  Очень буду благодарна за ответ."
NjBSy2Da4KE,"Замечательное объяснение, спасибо большое"
NjBSy2Da4KE,"Как замучилась с этим зубом зуб начил реагироватьна гооячее и сладкой, оказалось повторный карис под пломбой, канал вылеили всё сделали, но зуб всё же реагирвует на горячее но более слабее но не приятно и больно , а на сладкое перестал  реаг ровать, не знаю как это можно понять при живании не болит."
NjBSy2Da4KE,"У меня убили нерв и поставили пломбу, при укусе не болит, но начал болеть именно вечером, не понимаю что случилось"
NjBSy2Da4KE,"Мне поставили пломбы (2019) 4 года назад, у меня жутко болела зуб, (2021г)потом я сходила в больницу мне делали рентген и обнаружели что половина нерв не убрали и кость повреждено, мне лечили итд, уже как бы норм, но когда я пью горячую чай у меня ощущение что всё-таки осталось нерв 🥲 и у меня зуб уже начинает вонять ужас, что мне теперь делать????"
NjBSy2Da4KE,Здравствуйте у меня вопрос после плоба хуже ищо болеть и 3шт зубы дёргаться 1шт плоба поставит катори пастовить плоба мне болеть уже сутка
NjBSy2Da4KE,"Здравствуйте. Поменяли старую пломбу , стал болеть при накусывание, при поподание чуть твёрже пищи. Через месяц  этот врач опять в этом зубе поменял пломбу , нечего не изменилась. Что делать обращаться в другую стомотологию ? Этот стоматолог менял пломбы в других зубах нечего не болит всё нормально, а вот в одном два раза менял и бестолку ."
NjBSy2Da4KE,"Добрый день! Во время укола анестезии мне воткнули иглу прямо в тройничный  нерв. Чувствую боли, как после удаления зуба мудрости: болит вся щека, отдаёт в висок и ухо, все нижние зубы стали очень чувствительными, даже здоровые.<br>От боли помогает только Нимесулид.<br>Через сколько времени могут пройти эти боли? Требует ли это вмешательства? С момента повреждения прошло уже 6 дней, боли остались, но с острых и стреляющих превратились в тупые ноющие."
NjBSy2Da4KE,"Мне поставили пломбу неделю назад но болит зуб нереально, нерв осталось че делать то"
NjBSy2Da4KE,"У меня странная ситуация,не знаю как объяснить,мне ставили пломбу, когда накусываю 1-ый раз болит,а дальше нет😅,и так всегда, почему так?сначала мышьяк(таже самая боль),а теперь пломба,ставили пломбу 4 дня назад"
NjBSy2Da4KE,У меня тоже самое  поставил пломбу уже во второй раз  и болит при сладкого вкуса или питья воды
NjBSy2Da4KE,"Здравствуйте. Больно ли ставить пломбу на больной зуб, без укола? Обезболивающие называется вроде"
NjBSy2Da4KE,Добрый вечер у меня  после пломба шесть ой день Зуба болеть очень сильный бол и голова болеть
NjBSy2Da4KE,"Здраствуйте у меня зуб болит после пломбы, прошло уже 2 месяца до сих пор болить,что делать можно что то делать в домашних условиях"
NjBSy2Da4KE,Здравствуйте. После установления пломбы болит зуб именно когда я ем. Уже 4 дня
NjBSy2Da4KE,У меня болит зуб уже 24 часа это нормально?
NjBSy2Da4KE,"У меня даже нерва там нет, но болит ощущение вкрученного болта"
NjBSy2Da4KE,да правильно касяк дантиста надо исправлять зубной пастой
NjBSy2Da4KE,Через сколько можно курить после установки пломбы?
NjBSy2Da4KE,"Спасибо! Понятно, просто и доступно объяснили!"
NjBSy2Da4KE,"а,а,а,а,а,а,а,а,а,а, через каждое слово"
0cGR9PKajbQ,"✓ <a href=""https://drkonnikov.ru/"">https://drkonnikov.ru/</a> - Стоматология Олега Конникова. На базе концептуальной клиники, мы создали новую клинику базовой стоматологии, где цена и качество соответствует современным требованиям. Заходите и записывайтесь на консультацию."
0cGR9PKajbQ,"Доктор, вы много говорили, но не обьяснили, ни причины возникновения заболевания, ни способов лечения"
0cGR9PKajbQ,Мне стоматолог сказал что это не лечится
0cGR9PKajbQ,"Blya blya blya, весь ролик будет болтать. Как нормальный стоматолог или просто человек не может обратить внимание что у него корни скоро зубы будут вылазить наружу, Почему лечение в стоматологии равно построить самолёт? Бесполезный ролик"
0cGR9PKajbQ,Скажите настоящее ваше имя и фамилию!!!ЕВРЕЙ!!!😏
0cGR9PKajbQ,"У меня так было, я сделала професиональную чистку зубов в стоматологии.И на своё удивление, зубы стали на своё место.Оказывается, &lt; камни&gt; на зубах, такое делали с зубами.<br>А когда делала чисткк то спросила , почему такое происходит с зубами , а мне дали ответ: вам нужно к врачу.<br>А всё стало так как прежде через месяц после чистки, само по себе)"
0cGR9PKajbQ,"Лишь в России недоступна хорошая стоматология, наших людей за бугром  узнают по зубам. Считаю, что умышленно раздуто ценообразование в стоматологии."
0cGR9PKajbQ,Это не лечится.
0cGR9PKajbQ,Походу цены у вас нереальные?! Раз нет прайса на с ценами на услуги😊
0cGR9PKajbQ,"Стоматологи молчат про обычный способ востановления десен :  Обычная соль .  забудьте про зубную пасту . Она не лечит к слову вообще .  На зубах есть бактерии которые портят окр среду , мало того  заражение отбивает нрвные окончания (по этому часто такие зубы не болят ) . Уже задолблался у врачей спрашивать как это изменить (столько насоветовали апликации крема мази пока применять будешь не факт что ещё поможет ...плавали знаем не раз . . Чистка зубов пастой  не помогает вообще .   Камни на передних зубах и сниженные дёсны .  Когда появился зуд в зубах и попер запах гнили . Просто тупо вспомнил про чистку содой или солью и хотя бы полчаса не есть, плюс полоскания для рта .  За пять дней очистились и начали востанавливаться десны . Отвалились камни .  Продолжаю  чистить зубы солью , дурной запах изо рта пропал . <br>Раньше не было зубных паст чистили лишь пальцем с солью .  И дёсны были здоровее .  <br> С кремами для суставов таже песня , ценник весёлый , а на деле хрень .   Сырьё (сабельник ,амарант ) сушёный вскипятить на водяной бане в подсолнечном масле 45 минут настоять 7 дней процедить . получите живое масло для приёма во внутрь .  Добавьте на 150 грам готового масла 50 грам пчелиный воск . Прогреть масло до растворения воска подождать до полного остывания  получите готовую мазь . наружнего применения , которое работает, а не собирает бабло . ЧЁ ВЫ ЗАНИМАЕТЕСЬ САМО ЛЕЧЕНИЕМ ?? НАДО К ДОКТОРУ !!!! У меня денег нет лечиться ,а трава , старые знания ,прекрасно работают . Медицина поставлена на деньги не на здоровье ."
0cGR9PKajbQ,"Точно, всё как у меня. Не правильный прикус."
0cGR9PKajbQ,"Стоматологи - это отдельная каста. Откуда такие цены берутся не совместимые с жизнью😢??? А кроме зубов есть ещё органы, которые надо лечить…"
0cGR9PKajbQ,Зубочистки могут травмировать десну
